{
  "$schema": "corpus-baseline.schema.json",
  "schemaVersion": 1,
  "updated": "2026-10-25",
  "policy": {
    "records": "Only the round trips that lose something or warn about something. Everything this corpus can do that is absent from the list below is asserted to round trip clean, so a new loss fails by not being listed.",
    "reproduce": "A row that stops reproducing fails too. That is deliberate: a fix should arrive with this file updated, so the shrinking of the suspected-defect list is a thing somebody can point at.",
    "states": "documented - a limitation one of the conformance documents states. suspected-defect - a difference nobody decided on, which is what the CLI guide says round-tripping is actually good for. accepted - the normalized model's own behaviour, looked at and accepted.",
    "reviewer": "A row is not classified by being written down. documented and accepted both need a reviewer and a date, and a documented row needs a reference to the document that states the limitation. CorpusBaselineGuardTests enforces it, the way PdfTestControlGuardTests does for the tool manifest.",
    "regenerate": "dotnet run --project src/tests/Broiler.Documents.Corpus -- --update-baseline"
  },
  "roundTrips": [
    {
      "sample": "alignment",
      "source": "docx",
      "via": "markdown",
      "differences": [
        "paragraph-style@p1: alignment Center vs Left",
        "paragraph-style@p2: alignment Right vs Left",
        "paragraph-style@p3: alignment Justify vs Left"
      ],
      "diagnostics": [
        "markdown.paragraph-style"
      ],
      "state": "documented",
      "reference": "docs/notes/markdown.md",
      "why": "Markdown has no way to express this and says so. docs/notes/markdown.md maps the writer property by property, and it reports markdown.paragraph-style or markdown.inline-style rather than dropping it silently.",
      "reviewer": "Claude Opus 5, on the writer-losses pass",
      "decided": "2026-09-05"
    },
    {
      "sample": "alignment",
      "source": "html",
      "via": "markdown",
      "differences": [
        "paragraph-style@p1: alignment Center vs Left",
        "paragraph-style@p2: alignment Right vs Left",
        "paragraph-style@p3: alignment Justify vs Left"
      ],
      "diagnostics": [
        "markdown.paragraph-style"
      ],
      "state": "documented",
      "reference": "docs/notes/markdown.md",
      "why": "Markdown has no way to express this and says so. docs/notes/markdown.md maps the writer property by property, and it reports markdown.paragraph-style or markdown.inline-style rather than dropping it silently.",
      "reviewer": "Claude Opus 5, on the writer-losses pass",
      "decided": "2026-09-05"
    },
    {
      "sample": "alignment",
      "source": "odt",
      "via": "markdown",
      "differences": [
        "paragraph-style@p1: alignment Center vs Left",
        "paragraph-style@p2: alignment Right vs Left",
        "paragraph-style@p3: alignment Justify vs Left"
      ],
      "diagnostics": [
        "markdown.paragraph-style"
      ],
      "state": "documented",
      "reference": "docs/notes/markdown.md",
      "why": "Markdown has no way to express this and says so. docs/notes/markdown.md maps the writer property by property, and it reports markdown.paragraph-style or markdown.inline-style rather than dropping it silently.",
      "reviewer": "Claude Opus 5, on the writer-losses pass",
      "decided": "2026-09-05"
    },
    {
      "sample": "alignment",
      "source": "rtf",
      "via": "markdown",
      "differences": [
        "paragraph-style@p1: alignment Center vs Left",
        "paragraph-style@p2: alignment Right vs Left",
        "paragraph-style@p3: alignment Justify vs Left"
      ],
      "diagnostics": [
        "markdown.paragraph-style"
      ],
      "state": "documented",
      "reference": "docs/notes/markdown.md",
      "why": "Markdown has no way to express this and says so. docs/notes/markdown.md maps the writer property by property, and it reports markdown.paragraph-style or markdown.inline-style rather than dropping it silently.",
      "reviewer": "Claude Opus 5, on the writer-losses pass",
      "decided": "2026-09-05"
    },
    {
      "sample": "colour",
      "source": "docx",
      "via": "markdown",
      "differences": [
        "inline-style@p0: formatting differs from character 0: foreground #B71C1CFF vs default"
      ],
      "diagnostics": [
        "markdown.inline-style"
      ],
      "state": "documented",
      "reference": "docs/notes/markdown.md",
      "why": "Markdown has no way to express this and says so. docs/notes/markdown.md maps the writer property by property, and it reports markdown.paragraph-style or markdown.inline-style rather than dropping it silently.",
      "reviewer": "Claude Opus 5, on the writer-losses pass",
      "decided": "2026-09-05"
    },
    {
      "sample": "colour",
      "source": "html",
      "via": "markdown",
      "differences": [
        "inline-style@p0: formatting differs from character 0: foreground #B71C1CFF vs default"
      ],
      "diagnostics": [
        "markdown.inline-style"
      ],
      "state": "documented",
      "reference": "docs/notes/markdown.md",
      "why": "Markdown has no way to express this and says so. docs/notes/markdown.md maps the writer property by property, and it reports markdown.paragraph-style or markdown.inline-style rather than dropping it silently.",
      "reviewer": "Claude Opus 5, on the writer-losses pass",
      "decided": "2026-09-05"
    },
    {
      "sample": "colour",
      "source": "odt",
      "via": "markdown",
      "differences": [
        "inline-style@p0: formatting differs from character 0: foreground #B71C1CFF vs default"
      ],
      "diagnostics": [
        "markdown.inline-style"
      ],
      "state": "documented",
      "reference": "docs/notes/markdown.md",
      "why": "Markdown has no way to express this and says so. docs/notes/markdown.md maps the writer property by property, and it reports markdown.paragraph-style or markdown.inline-style rather than dropping it silently.",
      "reviewer": "Claude Opus 5, on the writer-losses pass",
      "decided": "2026-09-05"
    },
    {
      "sample": "colour",
      "source": "rtf",
      "via": "markdown",
      "differences": [
        "inline-style@p0: formatting differs from character 0: foreground #B71C1CFF vs default"
      ],
      "diagnostics": [
        "markdown.inline-style"
      ],
      "state": "documented",
      "reference": "docs/notes/markdown.md",
      "why": "Markdown has no way to express this and says so. docs/notes/markdown.md maps the writer property by property, and it reports markdown.paragraph-style or markdown.inline-style rather than dropping it silently.",
      "reviewer": "Claude Opus 5, on the writer-losses pass",
      "decided": "2026-09-05"
    },
    {
      "sample": "control-characters",
      "source": "html",
      "via": "docx",
      "differences": [
        "missing@p0: paragraph only in the left document: \"Bell \u0007 and vertical tab \u000b here.\"",
        "text@p1: text differs: \"Unit separator \u001f and start of heading \u0001 here.\" vs \"Bell  and vertical tab  here.\"",
        "extra@p?: paragraph only in the right document: \"Unit separator  and start of heading  here.\""
      ],
      "diagnostics": [
        "docx.text.control"
      ],
      "state": "documented",
      "reference": "docs/notes/docx.md",
      "why": "XML 1.0 has no representation for most control characters, not even an escape, so the two package writers drop them and report it - docx.text.control and odt.text.control. The character reaches the model from ordinary input: the HTML reader decodes &#7; and the RTF reader passes \\u7 through. The DOCX writer used to hand them to the serializer instead, and the tool reported an internal error, which docs/guides/cli.md defines as always a defect in it.",
      "reviewer": "Claude Opus 5, on the control-character pass",
      "decided": "2026-09-05"
    },
    {
      "sample": "control-characters",
      "source": "html",
      "via": "odt",
      "differences": [
        "missing@p0: paragraph only in the left document: \"Bell \u0007 and vertical tab \u000b here.\"",
        "text@p1: text differs: \"Unit separator \u001f and start of heading \u0001 here.\" vs \"Bell and vertical tab here.\"",
        "extra@p?: paragraph only in the right document: \"Unit separator and start of heading here.\""
      ],
      "diagnostics": [
        "odt.text.control"
      ],
      "state": "documented",
      "reference": "docs/notes/odt.md",
      "why": "XML 1.0 has no representation for most control characters, not even an escape, so the two package writers drop them and report it - docx.text.control and odt.text.control. The character reaches the model from ordinary input: the HTML reader decodes &#7; and the RTF reader passes \\u7 through. The DOCX writer used to hand them to the serializer instead, and the tool reported an internal error, which docs/guides/cli.md defines as always a defect in it.",
      "reviewer": "Claude Opus 5, on the control-character pass",
      "decided": "2026-09-05"
    },
    {
      "sample": "control-characters",
      "source": "markdown",
      "via": "docx",
      "differences": [
        "missing@p0: paragraph only in the left document: \"Bell \u0007 and vertical tab \u000b here.\"",
        "text@p1: text differs: \"Unit separator \u001f and start of heading \u0001 here.\" vs \"Bell  and vertical tab  here.\"",
        "extra@p?: paragraph only in the right document: \"Unit separator  and start of heading  here.\""
      ],
      "diagnostics": [
        "docx.text.control"
      ],
      "state": "documented",
      "reference": "docs/notes/docx.md",